
APP_FOLDER = None
APP_RUNNING = True
# LOAD THIS VERSION
APP_VERSION = "0.0"


def get_app_folder():
    global Logger, APP_FOLDER
    ret = ""
    # Adjusted to save APP_FOLDER - issue #6 - app_folder not returning the same folder later in the app?
    if APP_FOLDER is None:
        # return the folder this app is running in.
        # Logger.info("Application: get_app_folder called...")
        if getattr(sys, 'frozen', False):
            # Running in pyinstaller bundle
            ret = sys._MEIPASS
            # Logger.info("Application: sys._MEIPASS " + sys._MEIPASS)
            # Adjust to use sys.executable to deal with issue #6 - path different if cwd done
            # ret = os.path.dirname(sys.executable)
            # Logger.info("AppPath: sys.executable " + ret)

        else:
            ret = os.path.dirname(os.path.abspath(__file__))
            # Logger.info("AppPath: __file__ " + ret)
        APP_FOLDER = ret
        # Add this folder to the os path so that resources can be found more reliably
        text_dir = os.path.join(APP_FOLDER, "kivy\\core\\text")
        os.environ["PATH"] = os.environ["PATH"] + ";" + ret + ";" + text_dir
        print("-- ADJUSTING SYS PATH -- " + os.environ["PATH"])

    else:
        ret = APP_FOLDER
    return ret


# Run as app starts to make sure we save the current app folder
# in response to issue #6
get_app_folder()
print("APP FOLDER " + APP_FOLDER)







"""
Running C:/Users/ray/Desktop/git_projects/ope/laptop_credential/app.py
PyDev console: starting.
Device Found: 0
DEVICE ID 8087:0024 on Bus 001 Address 002 =================
 bLength                :   0x12 (18 bytes)
 bDescriptorType        :    0x1 Device
 bcdUSB                 :  0x200 USB 2.0
 bDeviceClass           :    0x9 Hub
 bDeviceSubClass        :    0x0
 bDeviceProtocol        :    0x1
 bMaxPacketSize0        :   0x40 (64 bytes)
 idVendor               : 0x8087
 idProduct              : 0x0024
 bcdDevice              :    0x0 Device 0.0
 iManufacturer          :    0x0
 iProduct               :    0x0
 iSerialNumber          :    0x0
 bNumConfigurations     :    0x1
  CONFIGURATION 1: 0 mA ====================================
   bLength              :    0x9 (9 bytes)
   bDescriptorType      :    0x2 Configuration
   wTotalLength         :   0x19 (25 bytes)
   bNumInterfaces       :    0x1
   bConfigurationValue  :    0x1
   iConfiguration       :    0x0
   bmAttributes         :   0xe0 Self Powered, Remote Wakeup
   bMaxPower            :    0x0 (0 mA)
    INTERFACE 0: Hub =======================================
     bLength            :    0x9 (9 bytes)
     bDescriptorType    :    0x4 Interface
     bInterfaceNumber   :    0x0
     bAlternateSetting  :    0x0
     bNumEndpoints      :    0x1
     bInterfaceClass    :    0x9 Hub
     bInterfaceSubClass :    0x0
     bInterfaceProtocol :    0x0
     iInterface         :    0x0
      ENDPOINT 0x81: Interrupt IN ==========================
       bLength          :    0x7 (7 bytes)
       bDescriptorType  :    0x5 Endpoint
       bEndpointAddress :   0x81 IN
       bmAttributes     :    0x3 Interrupt
       wMaxPacketSize   :    0x1 (1 bytes)
       bInterval        :    0xc
Device Found: 0
Device Found: 12288
DEVICE ID 0bda:8153 on Bus 001 Address 004 =================
 bLength                :   0x12 (18 bytes)
 bDescriptorType        :    0x1 Device
 bcdUSB                 :  0x210 USB 2.1
 bDeviceClass           :    0x0 Specified at interface
 bDeviceSubClass        :    0x0
 bDeviceProtocol        :    0x0
 bMaxPacketSize0        :   0x40 (64 bytes)
 idVendor               : 0x0bda
 idProduct              : 0x8153
 bcdDevice              : 0x3000 Device 48.0
 iManufacturer          :    0x1 Error Accessing String
 iProduct               :    0x2 Error Accessing String
 iSerialNumber          :    0x6 Error Accessing String
 bNumConfigurations     :    0x2
  CONFIGURATION 1: 180 mA ==================================
   bLength              :    0x9 (9 bytes)
   bDescriptorType      :    0x2 Configuration
   wTotalLength         :   0x27 (39 bytes)
   bNumInterfaces       :    0x1
   bConfigurationValue  :    0x1
   iConfiguration       :    0x0
   bmAttributes         :   0xa0 Bus Powered, Remote Wakeup
   bMaxPower            :   0x5a (180 mA)
    INTERFACE 0: Vendor Specific ===========================
     bLength            :    0x9 (9 bytes)
     bDescriptorType    :    0x4 Interface
     bInterfaceNumber   :    0x0
     bAlternateSetting  :    0x0
     bNumEndpoints      :    0x3
     bInterfaceClass    :   0xff Vendor Specific
     bInterfaceSubClass :   0xff
     bInterfaceProtocol :    0x0
     iInterface         :    0x0
      ENDPOINT 0x81: Bulk IN ===============================
       bLength          :    0x7 (7 bytes)
       bDescriptorType  :    0x5 Endpoint
       bEndpointAddress :   0x81 IN
       bmAttributes     :    0x2 Bulk
       wMaxPacketSize   :  0x200 (512 bytes)
       bInterval        :    0x0
      ENDPOINT 0x2: Bulk OUT ===============================
       bLength          :    0x7 (7 bytes)
       bDescriptorType  :    0x5 Endpoint
       bEndpointAddress :    0x2 OUT
       bmAttributes     :    0x2 Bulk
       wMaxPacketSize   :  0x200 (512 bytes)
       bInterval        :    0x0
      ENDPOINT 0x83: Interrupt IN ==========================
       bLength          :    0x7 (7 bytes)
       bDescriptorType  :    0x5 Endpoint
       bEndpointAddress :   0x83 IN
       bmAttributes     :    0x3 Interrupt
       wMaxPacketSize   :    0x2 (2 bytes)
       bInterval        :    0x8
  CONFIGURATION 2: 180 mA ==================================
   bLength              :    0x9 (9 bytes)
   bDescriptorType      :    0x2 Configuration
   wTotalLength         :   0x50 (80 bytes)
   bNumInterfaces       :    0x2
   bConfigurationValue  :    0x2
   iConfiguration       :    0x0
   bmAttributes         :   0xa0 Bus Powered, Remote Wakeup
   bMaxPower            :   0x5a (180 mA)
    INTERFACE 0: CDC Communication =========================
     bLength            :    0x9 (9 bytes)
     bDescriptorType    :    0x4 Interface
     bInterfaceNumber   :    0x0
     bAlternateSetting  :    0x0
     bNumEndpoints      :    0x1
     bInterfaceClass    :    0x2 CDC Communication
     bInterfaceSubClass :    0x6
     bInterfaceProtocol :    0x0
     iInterface         :    0x5 Error Accessing String
      ENDPOINT 0x83: Interrupt IN ==========================
       bLength          :    0x7 (7 bytes)
       bDescriptorType  :    0x5 Endpoint
       bEndpointAddress :   0x83 IN
       bmAttributes     :    0x3 Interrupt
       wMaxPacketSize   :   0x10 (16 bytes)
       bInterval        :    0x8
    INTERFACE 1: CDC Data ==================================
     bLength            :    0x9 (9 bytes)
     bDescriptorType    :    0x4 Interface
     bInterfaceNumber   :    0x1
     bAlternateSetting  :    0x0
     bNumEndpoints      :    0x0
     bInterfaceClass    :    0xa CDC Data
     bInterfaceSubClass :    0x0
     bInterfaceProtocol :    0x0
     iInterface         :    0x0
    INTERFACE 1, 1: CDC Data ===============================
     bLength            :    0x9 (9 bytes)
     bDescriptorType    :    0x4 Interface
     bInterfaceNumber   :    0x1
     bAlternateSetting  :    0x1
     bNumEndpoints      :    0x2
     bInterfaceClass    :    0xa CDC Data
     bInterfaceSubClass :    0x0
     bInterfaceProtocol :    0x0
     iInterface         :    0x4 Error Accessing String
      ENDPOINT 0x81: Bulk IN ===============================
       bLength          :    0x7 (7 bytes)
       bDescriptorType  :    0x5 Endpoint
       bEndpointAddress :   0x81 IN
       bmAttributes     :    0x2 Bulk
       wMaxPacketSize   :  0x200 (512 bytes)
       bInterval        :    0x0
      ENDPOINT 0x2: Bulk OUT ===============================
       bLength          :    0x7 (7 bytes)
       bDescriptorType  :    0x5 Endpoint
       bEndpointAddress :    0x2 OUT
       bmAttributes     :    0x2 Bulk
       wMaxPacketSize   :  0x200 (512 bytes)
       bInterval        :    0x0
Device Found: 1874
DEVICE ID 04f2:b221 on Bus 001 Address 006 =================
 bLength                :   0x12 (18 bytes)
 bDescriptorType        :    0x1 Device
 bcdUSB                 :  0x200 USB 2.0
 bDeviceClass           :   0xef Miscellaneous
 bDeviceSubClass        :    0x2
 bDeviceProtocol        :    0x1
 bMaxPacketSize0        :   0x40 (64 bytes)
 idVendor               : 0x04f2
 idProduct              : 0xb221
 bcdDevice              :  0x752 Device 7.52
 iManufacturer          :    0x1 Error Accessing String
 iProduct               :    0x2 Error Accessing String
 iSerialNumber          :    0x0
 bNumConfigurations     :    0x1
  CONFIGURATION 1: 200 mA ==================================
   bLength              :    0x9 (9 bytes)
   bDescriptorType      :    0x2 Configuration
   wTotalLength         :  0x320 (800 bytes)
   bNumInterfaces       :    0x2
   bConfigurationValue  :    0x1
   iConfiguration       :    0x0
   bmAttributes         :   0x80 Bus Powered
   bMaxPower            :   0x64 (200 mA)
    INTERFACE 0: Video =====================================
     bLength            :    0x9 (9 bytes)
     bDescriptorType    :    0x4 Interface
     bInterfaceNumber   :    0x0
     bAlternateSetting  :    0x0
     bNumEndpoints      :    0x1
     bInterfaceClass    :    0xe Video
     bInterfaceSubClass :    0x1
     bInterfaceProtocol :    0x0
     iInterface         :    0x4 Error Accessing String
      ENDPOINT 0x81: Interrupt IN ==========================
       bLength          :    0x7 (7 bytes)
       bDescriptorType  :    0x5 Endpoint
       bEndpointAddress :   0x81 IN
       bmAttributes     :    0x3 Interrupt
       wMaxPacketSize   :   0x10 (16 bytes)
       bInterval        :    0x8
    INTERFACE 1: Video =====================================
     bLength            :    0x9 (9 bytes)
     bDescriptorType    :    0x4 Interface
     bInterfaceNumber   :    0x1
     bAlternateSetting  :    0x0
     bNumEndpoints      :    0x0
     bInterfaceClass    :    0xe Video
     bInterfaceSubClass :    0x2
     bInterfaceProtocol :    0x0
     iInterface         :    0x0
    INTERFACE 1, 1: Video ==================================
     bLength            :    0x9 (9 bytes)
     bDescriptorType    :    0x4 Interface
     bInterfaceNumber   :    0x1
     bAlternateSetting  :    0x1
     bNumEndpoints      :    0x1
     bInterfaceClass    :    0xe Video
     bInterfaceSubClass :    0x2
     bInterfaceProtocol :    0x0
     iInterface         :    0x0
      ENDPOINT 0x82: Isochronous IN ========================
       bLength          :    0x7 (7 bytes)
       bDescriptorType  :    0x5 Endpoint
       bEndpointAddress :   0x82 IN
       bmAttributes     :    0x5 Isochronous
       wMaxPacketSize   :  0x3c0 (960 bytes)
       bInterval        :    0x1
    INTERFACE 1, 2: Video ==================================
     bLength            :    0x9 (9 bytes)
     bDescriptorType    :    0x4 Interface
     bInterfaceNumber   :    0x1
     bAlternateSetting  :    0x2
     bNumEndpoints      :    0x1
     bInterfaceClass    :    0xe Video
     bInterfaceSubClass :    0x2
     bInterfaceProtocol :    0x0
     iInterface         :    0x0
      ENDPOINT 0x82: Isochronous IN ========================
       bLength          :    0x7 (7 bytes)
       bDescriptorType  :    0x5 Endpoint
       bEndpointAddress :   0x82 IN
       bmAttributes     :    0x5 Isochronous
       wMaxPacketSize   :  0x400 (1024 bytes)
       bInterval        :    0x1
    INTERFACE 1, 3: Video ==================================
     bLength            :    0x9 (9 bytes)
     bDescriptorType    :    0x4 Interface
     bInterfaceNumber   :    0x1
     bAlternateSetting  :    0x3
     bNumEndpoints      :    0x1
     bInterfaceClass    :    0xe Video
     bInterfaceSubClass :    0x2
     bInterfaceProtocol :    0x0
     iInterface         :    0x0
      ENDPOINT 0x82: Isochronous IN ========================
       bLength          :    0x7 (7 bytes)
       bDescriptorType  :    0x5 Endpoint
       bEndpointAddress :   0x82 IN
       bmAttributes     :    0x5 Isochronous
       wMaxPacketSize   :  0xb5c (2908 bytes)
       bInterval        :    0x1
    INTERFACE 1, 4: Video ==================================
     bLength            :    0x9 (9 bytes)
     bDescriptorType    :    0x4 Interface
     bInterfaceNumber   :    0x1
     bAlternateSetting  :    0x4
     bNumEndpoints      :    0x1
     bInterfaceClass    :    0xe Video
     bInterfaceSubClass :    0x2
     bInterfaceProtocol :    0x0
     iInterface         :    0x0
      ENDPOINT 0x82: Isochronous IN ========================
       bLength          :    0x7 (7 bytes)
       bDescriptorType  :    0x5 Endpoint
       bEndpointAddress :   0x82 IN
       bmAttributes     :    0x5 Isochronous
       wMaxPacketSize   :  0xc00 (3072 bytes)
       bInterval        :    0x1
    INTERFACE 1, 5: Video ==================================
     bLength            :    0x9 (9 bytes)
     bDescriptorType    :    0x4 Interface
     bInterfaceNumber   :    0x1
     bAlternateSetting  :    0x5
     bNumEndpoints      :    0x1
     bInterfaceClass    :    0xe Video
     bInterfaceSubClass :    0x2
     bInterfaceProtocol :    0x0
     iInterface         :    0x0
      ENDPOINT 0x82: Isochronous IN ========================
       bLength          :    0x7 (7 bytes)
       bDescriptorType  :    0x5 Endpoint
       bEndpointAddress :   0x82 IN
       bmAttributes     :    0x5 Isochronous
       wMaxPacketSize   : 0x135c (4956 bytes)
       bInterval        :    0x1
    INTERFACE 1, 6: Video ==================================
     bLength            :    0x9 (9 bytes)
     bDescriptorType    :    0x4 Interface
     bInterfaceNumber   :    0x1
     bAlternateSetting  :    0x6
     bNumEndpoints      :    0x1
     bInterfaceClass    :    0xe Video
     bInterfaceSubClass :    0x2
     bInterfaceProtocol :    0x0
     iInterface         :    0x0
      ENDPOINT 0x82: Isochronous IN ========================
       bLength          :    0x7 (7 bytes)
       bDescriptorType  :    0x5 Endpoint
       bEndpointAddress :   0x82 IN
       bmAttributes     :    0x5 Isochronous
       wMaxPacketSize   : 0x13c0 (5056 bytes)
       bInterval        :    0x1
    INTERFACE 1, 7: Video ==================================
     bLength            :    0x9 (9 bytes)
     bDescriptorType    :    0x4 Interface
     bInterfaceNumber   :    0x1
     bAlternateSetting  :    0x7
     bNumEndpoints      :    0x1
     bInterfaceClass    :    0xe Video
     bInterfaceSubClass :    0x2
     bInterfaceProtocol :    0x0
     iInterface         :    0x0
      ENDPOINT 0x82: Isochronous IN ========================
       bLength          :    0x7 (7 bytes)
       bDescriptorType  :    0x5 Endpoint
       bEndpointAddress :   0x82 IN
       bmAttributes     :    0x5 Isochronous
       wMaxPacketSize   : 0x13fc (5116 bytes)
       bInterval        :    0x1
Device Found: 272
DEVICE ID 062a:4101 on Bus 001 Address 003 =================
 bLength                :   0x12 (18 bytes)
 bDescriptorType        :    0x1 Device
 bcdUSB                 :  0x110 USB 1.1
 bDeviceClass           :    0x0 Specified at interface
 bDeviceSubClass        :    0x0
 bDeviceProtocol        :    0x0
 bMaxPacketSize0        :    0x8 (8 bytes)
 idVendor               : 0x062a
 idProduct              : 0x4101
 bcdDevice              :  0x110 Device 1.1
 iManufacturer          :    0x1 Error Accessing String
 iProduct               :    0x2 Error Accessing String
 iSerialNumber          :    0x0
 bNumConfigurations     :    0x1
  CONFIGURATION 1: 100 mA ==================================
   bLength              :    0x9 (9 bytes)
   bDescriptorType      :    0x2 Configuration
   wTotalLength         :   0x3b (59 bytes)
   bNumInterfaces       :    0x2
   bConfigurationValue  :    0x1
   iConfiguration       :    0x0
   bmAttributes         :   0xa0 Bus Powered, Remote Wakeup
   bMaxPower            :   0x32 (100 mA)
    INTERFACE 0: Human Interface Device ====================
     bLength            :    0x9 (9 bytes)
     bDescriptorType    :    0x4 Interface
     bInterfaceNumber   :    0x0
     bAlternateSetting  :    0x0
     bNumEndpoints      :    0x1
     bInterfaceClass    :    0x3 Human Interface Device
     bInterfaceSubClass :    0x1
     bInterfaceProtocol :    0x1
     iInterface         :    0x0
      ENDPOINT 0x81: Interrupt IN ==========================
       bLength          :    0x7 (7 bytes)
       bDescriptorType  :    0x5 Endpoint
       bEndpointAddress :   0x81 IN
       bmAttributes     :    0x3 Interrupt
       wMaxPacketSize   :    0x8 (8 bytes)
       bInterval        :    0xa
    INTERFACE 1: Human Interface Device ====================
     bLength            :    0x9 (9 bytes)
     bDescriptorType    :    0x4 Interface
     bInterfaceNumber   :    0x1
     bAlternateSetting  :    0x0
     bNumEndpoints      :    0x1
     bInterfaceClass    :    0x3 Human Interface Device
     bInterfaceSubClass :    0x1
     bInterfaceProtocol :    0x2
     iInterface         :    0x0
      ENDPOINT 0x82: Interrupt IN ==========================
       bLength          :    0x7 (7 bytes)
       bDescriptorType  :    0x5 Endpoint
       bEndpointAddress :   0x82 IN
       bmAttributes     :    0x3 Interrupt
       wMaxPacketSize   :    0x7 (7 bytes)
       bInterval        :    0x2
Device Found: 0
Device Found: 1864
DEVICE ID 0a5c:217f on Bus 001 Address 005 =================
 bLength                :   0x12 (18 bytes)
 bDescriptorType        :    0x1 Device
 bcdUSB                 :  0x200 USB 2.0
 bDeviceClass           :   0xe0 Wireless Controller
 bDeviceSubClass        :    0x1
 bDeviceProtocol        :    0x1
 bMaxPacketSize0        :   0x40 (64 bytes)
 idVendor               : 0x0a5c
 idProduct              : 0x217f
 bcdDevice              :  0x748 Device 7.48
 iManufacturer          :    0x1 Error Accessing String
 iProduct               :    0x2 Error Accessing String
 iSerialNumber          :    0x3 Error Accessing String
 bNumConfigurations     :    0x1
  CONFIGURATION 1: 0 mA ====================================
   bLength              :    0x9 (9 bytes)
   bDescriptorType      :    0x2 Configuration
   wTotalLength         :   0xd8 (216 bytes)
   bNumInterfaces       :    0x4
   bConfigurationValue  :    0x1
   iConfiguration       :    0x0
   bmAttributes         :   0xe0 Self Powered, Remote Wakeup
   bMaxPower            :    0x0 (0 mA)
    INTERFACE 0: Wireless Controller =======================
     bLength            :    0x9 (9 bytes)
     bDescriptorType    :    0x4 Interface
     bInterfaceNumber   :    0x0
     bAlternateSetting  :    0x0
     bNumEndpoints      :    0x3
     bInterfaceClass    :   0xe0 Wireless Controller
     bInterfaceSubClass :    0x1
     bInterfaceProtocol :    0x1
     iInterface         :    0x0
      ENDPOINT 0x81: Interrupt IN ==========================
       bLength          :    0x7 (7 bytes)
       bDescriptorType  :    0x5 Endpoint
       bEndpointAddress :   0x81 IN
       bmAttributes     :    0x3 Interrupt
       wMaxPacketSize   :   0x10 (16 bytes)
       bInterval        :    0x1
      ENDPOINT 0x82: Bulk IN ===============================
       bLength          :    0x7 (7 bytes)
       bDescriptorType  :    0x5 Endpoint
       bEndpointAddress :   0x82 IN
       bmAttributes     :    0x2 Bulk
       wMaxPacketSize   :   0x40 (64 bytes)
       bInterval        :    0x1
      ENDPOINT 0x2: Bulk OUT ===============================
       bLength          :    0x7 (7 bytes)
       bDescriptorType  :    0x5 Endpoint
       bEndpointAddress :    0x2 OUT
       bmAttributes     :    0x2 Bulk
       wMaxPacketSize   :   0x40 (64 bytes)
       bInterval        :    0x1
    INTERFACE 1: Wireless Controller =======================
     bLength            :    0x9 (9 bytes)
     bDescriptorType    :    0x4 Interface
     bInterfaceNumber   :    0x1
     bAlternateSetting  :    0x0
     bNumEndpoints      :    0x2
     bInterfaceClass    :   0xe0 Wireless Controller
     bInterfaceSubClass :    0x1
     bInterfaceProtocol :    0x1
     iInterface         :    0x0
      ENDPOINT 0x83: Isochronous IN ========================
       bLength          :    0x7 (7 bytes)
       bDescriptorType  :    0x5 Endpoint
       bEndpointAddress :   0x83 IN
       bmAttributes     :    0x1 Isochronous
       wMaxPacketSize   :    0x0 (0 bytes)
       bInterval        :    0x1
      ENDPOINT 0x3: Isochronous OUT ========================
       bLength          :    0x7 (7 bytes)
       bDescriptorType  :    0x5 Endpoint
       bEndpointAddress :    0x3 OUT
       bmAttributes     :    0x1 Isochronous
       wMaxPacketSize   :    0x0 (0 bytes)
       bInterval        :    0x1
    INTERFACE 1, 1: Wireless Controller ====================
     bLength            :    0x9 (9 bytes)
     bDescriptorType    :    0x4 Interface
     bInterfaceNumber   :    0x1
     bAlternateSetting  :    0x1
     bNumEndpoints      :    0x2
     bInterfaceClass    :   0xe0 Wireless Controller
     bInterfaceSubClass :    0x1
     bInterfaceProtocol :    0x1
     iInterface         :    0x0
      ENDPOINT 0x83: Isochronous IN ========================
       bLength          :    0x7 (7 bytes)
       bDescriptorType  :    0x5 Endpoint
       bEndpointAddress :   0x83 IN
       bmAttributes     :    0x1 Isochronous
       wMaxPacketSize   :    0x9 (9 bytes)
       bInterval        :    0x1
      ENDPOINT 0x3: Isochronous OUT ========================
       bLength          :    0x7 (7 bytes)
       bDescriptorType  :    0x5 Endpoint
       bEndpointAddress :    0x3 OUT
       bmAttributes     :    0x1 Isochronous
       wMaxPacketSize   :    0x9 (9 bytes)
       bInterval        :    0x1
    INTERFACE 1, 2: Wireless Controller ====================
     bLength            :    0x9 (9 bytes)
     bDescriptorType    :    0x4 Interface
     bInterfaceNumber   :    0x1
     bAlternateSetting  :    0x2
     bNumEndpoints      :    0x2
     bInterfaceClass    :   0xe0 Wireless Controller
     bInterfaceSubClass :    0x1
     bInterfaceProtocol :    0x1
     iInterface         :    0x0
      ENDPOINT 0x83: Isochronous IN ========================
       bLength          :    0x7 (7 bytes)
       bDescriptorType  :    0x5 Endpoint
       bEndpointAddress :   0x83 IN
       bmAttributes     :    0x1 Isochronous
       wMaxPacketSize   :   0x11 (17 bytes)
       bInterval        :    0x1
      ENDPOINT 0x3: Isochronous OUT ========================
       bLength          :    0x7 (7 bytes)
       bDescriptorType  :    0x5 Endpoint
       bEndpointAddress :    0x3 OUT
       bmAttributes     :    0x1 Isochronous
       wMaxPacketSize   :   0x11 (17 bytes)
       bInterval        :    0x1
    INTERFACE 1, 3: Wireless Controller ====================
     bLength            :    0x9 (9 bytes)
     bDescriptorType    :    0x4 Interface
     bInterfaceNumber   :    0x1
     bAlternateSetting  :    0x3
     bNumEndpoints      :    0x2
     bInterfaceClass    :   0xe0 Wireless Controller
     bInterfaceSubClass :    0x1
     bInterfaceProtocol :    0x1
     iInterface         :    0x0
      ENDPOINT 0x83: Isochronous IN ========================
       bLength          :    0x7 (7 bytes)
       bDescriptorType  :    0x5 Endpoint
       bEndpointAddress :   0x83 IN
       bmAttributes     :    0x1 Isochronous
       wMaxPacketSize   :   0x20 (32 bytes)
       bInterval        :    0x1
      ENDPOINT 0x3: Isochronous OUT ========================
       bLength          :    0x7 (7 bytes)
       bDescriptorType  :    0x5 Endpoint
       bEndpointAddress :    0x3 OUT
       bmAttributes     :    0x1 Isochronous
       wMaxPacketSize   :   0x20 (32 bytes)
       bInterval        :    0x1
    INTERFACE 1, 4: Wireless Controller ====================
     bLength            :    0x9 (9 bytes)
     bDescriptorType    :    0x4 Interface
     bInterfaceNumber   :    0x1
     bAlternateSetting  :    0x4
     bNumEndpoints      :    0x2
     bInterfaceClass    :   0xe0 Wireless Controller
     bInterfaceSubClass :    0x1
     bInterfaceProtocol :    0x1
     iInterface         :    0x0
      ENDPOINT 0x83: Isochronous IN ========================
       bLength          :    0x7 (7 bytes)
       bDescriptorType  :    0x5 Endpoint
       bEndpointAddress :   0x83 IN
       bmAttributes     :    0x1 Isochronous
       wMaxPacketSize   :   0x40 (64 bytes)
       bInterval        :    0x1
      ENDPOINT 0x3: Isochronous OUT ========================
       bLength          :    0x7 (7 bytes)
       bDescriptorType  :    0x5 Endpoint
       bEndpointAddress :    0x3 OUT
       bmAttributes     :    0x1 Isochronous
       wMaxPacketSize   :   0x40 (64 bytes)
       bInterval        :    0x1
    INTERFACE 1, 5: Wireless Controller ====================
     bLength            :    0x9 (9 bytes)
     bDescriptorType    :    0x4 Interface
     bInterfaceNumber   :    0x1
     bAlternateSetting  :    0x5
     bNumEndpoints      :    0x2
     bInterfaceClass    :   0xe0 Wireless Controller
     bInterfaceSubClass :    0x1
     bInterfaceProtocol :    0x1
     iInterface         :    0x0
      ENDPOINT 0x83: Isochronous IN ========================
       bLength          :    0x7 (7 bytes)
       bDescriptorType  :    0x5 Endpoint
       bEndpointAddress :   0x83 IN
       bmAttributes     :    0x1 Isochronous
       wMaxPacketSize   :   0x40 (64 bytes)
       bInterval        :    0x1
      ENDPOINT 0x3: Isochronous OUT ========================
       bLength          :    0x7 (7 bytes)
       bDescriptorType  :    0x5 Endpoint
       bEndpointAddress :    0x3 OUT
       bmAttributes     :    0x1 Isochronous
       wMaxPacketSize   :   0x40 (64 bytes)
       bInterval        :    0x1
    INTERFACE 2: Vendor Specific ===========================
     bLength            :    0x9 (9 bytes)
     bDescriptorType    :    0x4 Interface
     bInterfaceNumber   :    0x2
     bAlternateSetting  :    0x0
     bNumEndpoints      :    0x2
     bInterfaceClass    :   0xff Vendor Specific
     bInterfaceSubClass :   0xff
     bInterfaceProtocol :   0xff
     iInterface         :    0x0
      ENDPOINT 0x84: Bulk IN ===============================
       bLength          :    0x7 (7 bytes)
       bDescriptorType  :    0x5 Endpoint
       bEndpointAddress :   0x84 IN
       bmAttributes     :    0x2 Bulk
       wMaxPacketSize   :   0x20 (32 bytes)
       bInterval        :    0x1
      ENDPOINT 0x4: Bulk OUT ===============================
       bLength          :    0x7 (7 bytes)
       bDescriptorType  :    0x5 Endpoint
       bEndpointAddress :    0x4 OUT
       bmAttributes     :    0x2 Bulk
       wMaxPacketSize   :   0x20 (32 bytes)
       bInterval        :    0x1
    INTERFACE 3: Application Specific ======================
     bLength            :    0x9 (9 bytes)
     bDescriptorType    :    0x4 Interface
     bInterfaceNumber   :    0x3
     bAlternateSetting  :    0x0
     bNumEndpoints      :    0x0
     bInterfaceClass    :   0xfe Application Specific
     bInterfaceSubClass :    0x1
     bInterfaceProtocol :    0x1
     iInterface         :    0x0
Device Found: 272
DEVICE ID 062a:4101 on Bus 001 Address 003 =================
 bLength                :   0x12 (18 bytes)
 bDescriptorType        :    0x1 Device
 bcdUSB                 :  0x110 USB 1.1
 bDeviceClass           :    0x0 Specified at interface
 bDeviceSubClass        :    0x0
 bDeviceProtocol        :    0x0
 bMaxPacketSize0        :    0x8 (8 bytes)
 idVendor               : 0x062a
 idProduct              : 0x4101
 bcdDevice              :  0x110 Device 1.1
 iManufacturer          :    0x1 MOSART Semi.
 iProduct               :    0x2 2.4G Keyboard Mouse
 iSerialNumber          :    0x0
 bNumConfigurations     :    0x1
  CONFIGURATION 1: 100 mA ==================================
   bLength              :    0x9 (9 bytes)
   bDescriptorType      :    0x2 Configuration
   wTotalLength         :   0x3b (59 bytes)
   bNumInterfaces       :    0x2
   bConfigurationValue  :    0x1
   iConfiguration       :    0x0
   bmAttributes         :   0xa0 Bus Powered, Remote Wakeup
   bMaxPower            :   0x32 (100 mA)
    INTERFACE 0: Human Interface Device ====================
     bLength            :    0x9 (9 bytes)
     bDescriptorType    :    0x4 Interface
     bInterfaceNumber   :    0x0
     bAlternateSetting  :    0x0
     bNumEndpoints      :    0x1
     bInterfaceClass    :    0x3 Human Interface Device
     bInterfaceSubClass :    0x1
     bInterfaceProtocol :    0x1
     iInterface         :    0x0
      ENDPOINT 0x81: Interrupt IN ==========================
       bLength          :    0x7 (7 bytes)
       bDescriptorType  :    0x5 Endpoint
       bEndpointAddress :   0x81 IN
       bmAttributes     :    0x3 Interrupt
       wMaxPacketSize   :    0x8 (8 bytes)
       bInterval        :    0xa
    INTERFACE 1: Human Interface Device ====================
     bLength            :    0x9 (9 bytes)
     bDescriptorType    :    0x4 Interface
     bInterfaceNumber   :    0x1
     bAlternateSetting  :    0x0
     bNumEndpoints      :    0x1
     bInterfaceClass    :    0x3 Human Interface Device
     bInterfaceSubClass :    0x1
     bInterfaceProtocol :    0x2
     iInterface         :    0x0
      ENDPOINT 0x82: Interrupt IN ==========================
       bLength          :    0x7 (7 bytes)
       bDescriptorType  :    0x5 Endpoint
       bEndpointAddress :   0x82 IN
       bmAttributes     :    0x3 Interrupt
       wMaxPacketSize   :    0x7 (7 bytes)
       bInterval        :    0x2
Device Found: 0
DEVICE ID 8087:0024 on Bus 002 Address 002 =================
 bLength                :   0x12 (18 bytes)
 bDescriptorType        :    0x1 Device
 bcdUSB                 :  0x200 USB 2.0
 bDeviceClass           :    0x9 Hub
 bDeviceSubClass        :    0x0
 bDeviceProtocol        :    0x1
 bMaxPacketSize0        :   0x40 (64 bytes)
 idVendor               : 0x8087
 idProduct              : 0x0024
 bcdDevice              :    0x0 Device 0.0
 iManufacturer          :    0x0
 iProduct               :    0x0
 iSerialNumber          :    0x0
 bNumConfigurations     :    0x1
  CONFIGURATION 1: 0 mA ====================================
   bLength              :    0x9 (9 bytes)
   bDescriptorType      :    0x2 Configuration
   wTotalLength         :   0x19 (25 bytes)
   bNumInterfaces       :    0x1
   bConfigurationValue  :    0x1
   iConfiguration       :    0x0
   bmAttributes         :   0xe0 Self Powered, Remote Wakeup
   bMaxPower            :    0x0 (0 mA)
    INTERFACE 0: Hub =======================================
     bLength            :    0x9 (9 bytes)
     bDescriptorType    :    0x4 Interface
     bInterfaceNumber   :    0x0
     bAlternateSetting  :    0x0
     bNumEndpoints      :    0x1
     bInterfaceClass    :    0x9 Hub
     bInterfaceSubClass :    0x0
     bInterfaceProtocol :    0x0
     iInterface         :    0x0
      ENDPOINT 0x81: Interrupt IN ==========================
       bLength          :    0x7 (7 bytes)
       bDescriptorType  :    0x5 Endpoint
       bEndpointAddress :   0x81 IN
       bmAttributes     :    0x3 Interrupt
       wMaxPacketSize   :    0x2 (2 bytes)
       bInterval        :    0xc


"""


# import win32api
# import win32security
# import _winreg
#
# class Ace(object):
#     ace_flags = {win32security.CONTAINER_INHERIT_ACE: 'Container Inherit',
#                  win32security.FAILED_ACCESS_ACE_FLAG: 'Failed Access',
#                  win32security.INHERIT_ONLY_ACE: 'Inherit only',
#                  win32security.INHERITED_ACE: 'Inherited ACE',
#                  win32security.NO_PROPAGATE_INHERIT_ACE: 'No propagate',
#                  win32security.OBJECT_INHERIT_ACE: 'Object inherit',
#                  win32security.SUCCESSFUL_ACCESS_ACE_FLAG: 'Successful access'}
#
#     def __init__(self, ace):
#         self.ace = ace
#         ( (self.access_type, self.flags), self.mask, self.pysid) = ace
#
#     def getType(self):
#         if self.access_type == win32security.ACCESS_ALLOWED_ACE_TYPE:
#             return "Allow"
#         if self.access_type == win32security.ACCESS_DENIED_ACE_TYPE:
#             return "Deny"
#
#     def getFlags(self):
#         readable_flags = list()
#         for (f, v) in self.ace_flags.items():
#             if f & self.flags == f:
#                 readable_flags.append(v)
#         return readable_flags
#
# class RegKey(object):
#
#     registry_rights = {_winreg.KEY_ALL_ACCESS: 'All Access',
#                       _winreg.KEY_WRITE: 'Write',
#                       _winreg.KEY_READ: 'Read',
#                       _winreg.KEY_EXECUTE: 'Read',
#                       _winreg.KEY_QUERY_VALUE: 'Query value',
#                       _winreg.KEY_SET_VALUE: 'Set value',
#                       _winreg.KEY_CREATE_SUB_KEY: 'Create subkey',
#                       _winreg.KEY_ENUMERATE_SUB_KEYS: 'Enum subkeys',
#                       _winreg.KEY_NOTIFY: 'Request notification',
#                       _winreg.KEY_CREATE_LINK: 'Link (reserved)' }
#
#     def __init__(self, key_path, machine=None, root=_winreg.HKEY_LOCAL_MACHINE):
#         self.registry = _winreg.ConnectRegistry(None, root)
#         self.key_path = key_path
#         self.key = _winreg.OpenKey(self.registry, key_path)
#         self.security = win32api.RegGetKeySecurity(self.key.handle, win32security.DACL_SECURITY_INFORMATION)
#         self.dacl = self.security.GetSecurityDescriptorDacl()
#         self.aces = list()
#         for i in range(self.dacl.GetAceCount()):
#             self.aces.append(Ace(self.dacl.GetAce(i)))
#
#     def dump_values(self):
#         (subkey_count, value_count, last_modified) = _winreg.QueryInfoKey(self.key)
#         print "Values:"
#         for i in range(value_count):
#             (name, data, value_type) = _winreg.EnumValue(self.key, i)
#             print "\t{0}: {1}".format(name, data)
#
#     def dump_subkeys(self):
#         (subkey_count, value_count, last_modified) = _winreg.QueryInfoKey(self.key)
#         print "Subkeys:"
#         for i in range(subkey_count):
#            print "\t{0}".format(_winreg.EnumKey(self.key, i))
#
#     def dump_ace(self, ace):
#         print "Ace: {0}".format(ace.ace)
#         print " Type: {0}".format(ace.getType())
#         print " Flags: {0}".format(", ".join(ace.getFlags()))
#         account = win32security.LookupAccountSid(None, ace.pysid);
#         print " Account: {0}\{1}".format(account[1], account[0])
#         print " Access:"
#         if ace.mask & _winreg.KEY_ALL_ACCESS == _winreg.KEY_ALL_ACCESS:
#             print "\t{0}".format(self.registry_rights[_winreg.KEY_ALL_ACCESS])
#         else:
#             for (p, v) in self.registry_rights.items():
#                 if p & ace.mask == p:
#                    print "\t{0}".format(v)
#
#     def dump_dacl(self):
#         for ace in self.aces:
#             self.dump_ace(ace)
#             print
#
#
# if __name__ == '__main__':
#     r = RegKey(r"Software\Microsoft\Windows\CurrentVersion\Internet Settings",
#                root=_winreg.HKEY_CURRENT_USER)
#     r.dump_subkeys()
#     r.dump_values()
#     r.dump_dacl()
